variable,lower,upper,distribution,unit,description,remarks,sourcechance_market_crash,0.01,0.1,posnorm,%,probability that the market crashes and will have an effect on the pric eof the products  [%],,volume_target_rotation,21,36,posnorm,t/ha,volume of the aboveground woody component when the final timber harvest is conducted  [t/ha],Schindler et al (2023); and Sereke et al (2015),Baden-WÌ?rttemberg and Switzerlandtime_first_volume_est,3,3,const,year in number,Year in which first harvest of timber is expected,Schindler et al (2023); and Heim et al. (2023),Baden-WÌ?rttemberg and RestincliÌ¬res (Southern France)time_sec_volume_est,6,6,const,year in number,Year in which second timber yield stage is estimated for,Schindler et al (2023); and Heim et al. (2023),Baden-WÌ?rttemberg and RestincliÌ¬res (Southern France)sec_volume_est_per,100,100,const,%,Second stage timber yield [% of max nuts harvest],Schindler et al (2023); and Heim et al. (2023),Baden-WÌ?rttemberg and RestincliÌ¬res (Southern France)first_vol_rel_to_sec_est_perc,100,100,const,%,First nut timber yield [% of max nuts harvest],,af_fert_perc_reduction,0.7,0.9,posnorm,%,percentage fertilizer application reduced as a benefit of AF,assumed,pc_carbon_storage,0.49,6.09,posnorm,å£/ha/yr,price of Carbon storage (å£ ha-1 a-1),Kay et al 2019 and Schwegler (2014),https://doi.org/10.1007/978-3-030-80060-4pc_ground_water_recharge,0.06,1,posnorm,å£/ha/yr,price of groundwater (å£ ha-1 a-1),Kay et al 2019,AF1_soil_loss_water,2,4,posnorm,å£/ha/yr,soil loss in  tons/ha/year,Kay et al 2019,AF1_soil_loss_wind,2,4,posnorm,å£/ha/yr,soil loss in  tons/ha/year,,AF2_soil_loss_water,2,4,posnorm,å£/ha/yr,soil loss in  tons/ha/year,Kay et al 2019,AF2_soil_loss_wind,2,4,posnorm,å£/ha/yr,soil loss in  tons/ha/year,,pc_soil_loss,0.9,23,posnorm,å£/ha/yr,price of soil loss and environmental cost of loss disservice,Kay et al 2019,Nonmarket_ES_value,600,960,posnorm,å£/ha/yr,monetary value of ES in AF system å£/ ha/ y,Kay et al 2019,C_sequeter_max,75,90,posnorm,t C/ha/yr,from Marcos's model,,time_to_first_C_sequester,10,10,const,year in number,Second Year in which the C. sequestartion sold for credits,,time_to_second_C_sequester,15,15,const,year in number,First Year in which the C. sequestartion sold for credits,,C_sequester_first,2,5,posnorm,%,percentage of the maximum sequestration that is attained in the first year (or other time unit),,C_sequester_second,6,15,posnorm,%,percentage of the maximum sequesteration that is attained in the second year (or other time unit),,C_price,20,30,posnorm,å£/t,price per tonne of carbon sequestered,"https://ahdb.org.uk/news/price-disparities-between-carbon-markets#:~:text=For%202023%2C%20the%20UK%20ETS,%C2%A320%2Ft.",yield_reduc_max,0.9,0.95,posnorm,%,5 to 10% based on smaller shrubby shading effects,,time_to_first_reduction,3,3,const,year in number,Year in which the effect of tree on crop starts first,,time_to_second_reduction,6,6,const,year in number,Year in which the effect of tree on crop starts second,,perc_max_first_reduction,10,20,posnorm,%,percentage of the maximum yield reduction in the first year (or other time unit),,perc_max_second_reduction,20,30,posnorm,%,percentage of the maximum yield reduction in the second year (or other time unit),,yield_increase_max,1.05,1.14,posnorm,%,increase in pasture productivity due to wind protection ,,https://doi.org/10.2307/240275time_to_first_increase,3,3,const,year in number,Year in which the effect of tree on crop starts first,,time_to_second_increase,6,6,const,year in number,Year in which the effect of tree on crop starts second,,perc_max_first_increase,20,30,posnorm,%,percentage of the maximum yield reduction in the first year (or other time unit),,perc_max_second_increase,50,60,posnorm,%,percentage of the maximum yield reduction in the second year (or other time unit),,winter_grazing_effect,1.05,1.15,posnorm,%,positive yield effect or fertilization effect because of winter grazing,no,no
